{
    "maxVersionMajor": 1,
    "maxVersionMinor": 19,
    "maxVersionPatch": 70,
    "maxVersionRevision": 15,
    "remappedStates": {
        "minecraft:wool": [
            {
                "oldState": {
                    "color": {
                        "string": "white"
                    }
                },
                "newName": "minecraft:white_wool",
                "newState": null
            },
            {
                "oldState": {
                    "color": {
                        "string": "orange"
                    }
                },
                "newName": "minecraft:orange_wool",
                "newState": null
            },
            {
                "oldState": {
                    "color": {
                        "string": "magenta"
                    }
                },
                "newName": "minecraft:magenta_wool",
                "newState": null
            },
            {
                "oldState": {
                    "color": {
                        "string": "light_blue"
                    }
                },
                "newName": "minecraft:light_blue_wool",
                "newState": null
            },
            {
                "oldState": {
                    "color": {
                        "string": "yellow"
                    }
                },
                "newName": "minecraft:yellow_wool",
                "newState": null
            },
            {
                "oldState": {
                    "color": {
                        "string": "lime"
                    }
                },
                "newName": "minecraft:lime_wool",
                "newState": null
            },
            {
                "oldState": {
                    "color": {
                        "string": "pink"
                    }
                },
                "newName": "minecraft:pink_wool",
                "newState": null
            },
            {
                "oldState": {
                    "color": {
                        "string": "gray"
                    }
                },
                "newName": "minecraft:gray_wool",
                "newState": null
            },
            {
                "oldState": {
                    "color": {
                        "string": "silver"
                    }
                },
                "newName": "minecraft:light_gray_wool",
                "newState": null
            },
            {
                "oldState": {
                    "color": {
                        "string": "cyan"
                    }
                },
                "newName": "minecraft:cyan_wool",
                "newState": null
            },
            {
                "oldState": {
                    "color": {
                        "string": "purple"
                    }
                },
                "newName": "minecraft:purple_wool",
                "newState": null
            },
            {
                "oldState": {
                    "color": {
                        "string": "blue"
                    }
                },
                "newName": "minecraft:blue_wool",
                "newState": null
            },
            {
                "oldState": {
                    "color": {
                        "string": "brown"
                    }
                },
                "newName": "minecraft:brown_wool",
                "newState": null
            },
            {
                "oldState": {
                    "color": {
                        "string": "green"
                    }
                },
                "newName": "minecraft:green_wool",
                "newState": null
            },
            {
                "oldState": {
                    "color": {
                        "string": "red"
                    }
                },
                "newName": "minecraft:red_wool",
                "newState": null
            },
            {
                "oldState": {
                    "color": {
                        "string": "black"
                    }
                },
                "newName": "minecraft:black_wool",
                "newState": null
            }
        ]
    }
}
